{
  "schema_version": "1.0.0",
  "test_id": "P0-PI-0809-RESUME-IMPORT",
  "candidate": "neutral",
  "evidence_kind": "runtime",
  "status": "pass",
  "source_versions": {
    "pi": "@earendil-works/pi-coding-agent@0.80.9 (2d16f92973230a7e095aa984f150ba8702784f50)",
    "fixture": "cef5e049ab9841e8389c6c4f5f0fde5d2385c7b4"
  },
  "host": {
    "os": "macOS 15.7.7",
    "architecture": "arm64",
    "container_runtime": null
  },
  "sanitized_command": "node phase0/scripts/probe-pi-resume.mjs <generated-fixture>",
  "exit_code": 0,
  "started_at": "2026-07-16T21:10:07Z",
  "ended_at": "2026-07-16T21:10:10Z",
  "fixture_commit": "cef5e049ab9841e8389c6c4f5f0fde5d2385c7b4",
  "assertions": [
    {
      "name": "exact stop and resume restores native session without action replay",
      "passed": true,
      "observed": {
        "session_id_stable": true,
        "resume_count": 2,
        "completed_action_occurrences_each": 1
      }
    },
    {
      "name": "clean-home fork import preserves complete entry history and provenance",
      "passed": true,
      "observed": {
        "source_entry_count": 10,
        "imported_entry_count_after_append": 11,
        "new_session_id": "phase0-import",
        "parent_session_recorded": true
      }
    },
    {
      "name": "tool, custom, model-change, and unknown entries survive resume and import",
      "passed": true,
      "observed": {
        "tool_result_preserved": true,
        "custom_entry_preserved": true,
        "model_change_preserved": true,
        "unknown_entry_byte_equivalent": true,
        "new_action_descends_from_unknown_leaf": true
      }
    },
    {
      "name": "probe performs no provider request",
      "passed": true,
      "observed": {
        "isolated_auth_homes": 2,
        "offline_mode": true,
        "provider_commands_sent": 0
      }
    }
  ],
  "artifacts": [
    {
      "path": "phase0/scripts/probe-pi-resume.mjs",
      "sha256": "1ea0fd57e68448dd6bd44ea4143a0b629dbebb7c0f0d839ca829da143e42226a",
      "media_type": "text/javascript",
      "tracked": true
    },
    {
      "path": "untracked:phase0/pi-resume/source-session.jsonl",
      "sha256": "aa71d1e87a13055cc3160d30c6115ddaca3af4ecba591da8312fa1f99387cbbd",
      "media_type": "application/x-ndjson",
      "tracked": false
    },
    {
      "path": "untracked:phase0/pi-resume/imported-session.jsonl",
      "sha256": "03681845faefe7bcb9a28232034feb5b5b30280e3a7a112fbb5efef6b866edd9",
      "media_type": "application/x-ndjson",
      "tracked": false
    }
  ],
  "redactions": [],
  "mappings": {
    "product_requirements": ["PRODUCT 5.3", "PRODUCT 5.6"],
    "technical_risks": ["TECH risk 1", "TECH risk 11"],
    "hard_gates": ["G-02", "G-09"]
  },
  "limitations": [
    "Clean-home import uses Pi SessionManager.forkFrom semantics: it creates a new header and session identity while preserving every non-header entry and recording parentSession provenance.",
    "The unknown entry is synthetic forward-compatibility evidence; behavior for a future Pi entry with new runtime semantics cannot be inferred.",
    "Pi appended a thinking-level change during startup before the first resumed bash action; ancestry remained continuous but exact append adjacency is not guaranteed.",
    "No provider prompt was issued, so this result does not cover a live provider reconnect or partially streamed assistant turn."
  ]
}
