{
  "schema_version": "1.0.0",
  "test_id": "P0-RUNTIME-GIT-RTK",
  "candidate": "neutral",
  "evidence_kind": "runtime",
  "status": "pass",
  "source_versions": {
    "pi": "0.80.9",
    "rtk": "0.42.3",
    "node_base": "node:24-trixie-slim@sha256:ae91dcc111a68c9d2d81ff2a17bda61be126426176fde6fe7d08ab13b7f50573",
    "task_image": "sha256:7669de2c3791c662a1f59094ad31ff018178de20e843d3485c5796d545688074"
  },
  "host": {
    "os": "macOS 15.7.7",
    "architecture": "arm64",
    "container_runtime": "Docker Desktop"
  },
  "sanitized_command": "node phase0/scripts/probe-runtime-git-rtk.mjs /absolute/generated-fixture",
  "exit_code": 0,
  "started_at": "2026-07-17T01:56:27Z",
  "ended_at": "2026-07-17T01:56:28Z",
  "fixture_commit": "cef5e049ab9841e8389c6c4f5f0fde5d2385c7b4",
  "assertions": [
    {
      "name": "pinned ARM64 Linux task image contains the supported Pi and RTK versions",
      "passed": true,
      "observed": {
        "image_id": "sha256:7669de2c3791c662a1f59094ad31ff018178de20e843d3485c5796d545688074",
        "architecture": "arm64",
        "pi": "0.80.9",
        "rtk": "0.42.3"
      }
    },
    {
      "name": "task container edits only the assigned workspace under the least-privilege policy",
      "passed": true,
      "observed": {
        "uid": 65532,
        "read_only_root": true,
        "network": "none",
        "capabilities_dropped": "ALL",
        "docker_socket_absent": true,
        "host_home_absent": true,
        "workspace_edit_allowed": true
      }
    },
    {
      "name": "container cannot mutate shared Git metadata and the host creates a provenance-linked checkpoint",
      "passed": true,
      "observed": {
        "container_git_add_denied": true,
        "host_checkpoint_commit": "eb5bc95457d849f0755c29b3d04b0dcf0842f9ab",
        "provenance_trailers_present": true
      }
    },
    {
      "name": "concurrent run-scoped credentials do not mutate canonical auth state or persist synthetic canaries",
      "passed": true,
      "observed": {
        "concurrent_runs": 2,
        "canonical_auth_unchanged": true,
        "canary_violations": 0
      }
    },
    {
      "name": "RTK raw tee output is captured, redacted, receipted, and removed from the unredacted location",
      "passed": true,
      "observed": {
        "tee_mode": "always",
        "raw_artifacts": 1,
        "redaction_replacements": 2,
        "redacted_raw_sha256": "ace6f3405dd1fef1da2825e86c2bcbce059793e1f23204b226cb37d9211739ce",
        "filtered_sha256": "e985a2756ba5b7943cc55106ce471906be20c1fd02687150e5b5fec2ba3f25f5",
        "redaction_receipt_sha256": "468092f3826f4ff75df2bebf4d7fefa152ce89033b803eecc8987278fe5da602"
      }
    },
    {
      "name": "RTK exposes an explicit bypass and failure diagnostics while telemetry is disabled",
      "passed": true,
      "observed": {
        "proxy_bypass_visible": true,
        "unsupported_rewrite_exit_code": 1,
        "failure_report_available": true,
        "telemetry_disabled": true
      }
    }
  ],
  "artifacts": [
    {
      "path": "phase0/runtime/Dockerfile",
      "sha256": "74d1adaced02539f22aeccc8d62162a495c27219c13e5280a789ced0168d957a",
      "media_type": "text/x-dockerfile",
      "tracked": true
    },
    {
      "path": "phase0/runtime/container-policy.json",
      "sha256": "880246c80dddbf99be4eeb390f821d661445bb8db1187e2ab67f5c7ccb90b5fd",
      "media_type": "application/json",
      "tracked": true
    },
    {
      "path": "phase0/runtime/rtk-config.toml",
      "sha256": "2d6795cb7a748058a73dfa0d24d56e22f8cf946b9eeb8c86ddff862743a55dee",
      "media_type": "application/toml",
      "tracked": true
    },
    {
      "path": "phase0/scripts/probe-runtime-git-rtk.mjs",
      "sha256": "be28891c8c23a2f86eaa199e207f36575eeb654342145728f29fb5361673771a",
      "media_type": "text/javascript",
      "tracked": true
    }
  ],
  "redactions": [
    {
      "class": "synthetic_secret",
      "count": 2
    }
  ],
  "mappings": {
    "product_requirements": ["PRODUCT 7.2", "PRODUCT 7.3", "PRODUCT 7.4", "PRODUCT 7.7", "PRODUCT 7.8", "PRODUCT 8.3", "PRODUCT 9.6"],
    "technical_risks": ["TECH risk 4", "TECH risk 7", "TECH risk 8"],
    "hard_gates": ["G-05", "G-06"]
  },
  "limitations": [
    "This foundation-neutral probe remains the reference contract; candidate integration is recorded separately by P0-DIRECT-RUNTIME-GIT-RTK.",
    "Network access is disabled in this fixture, so live provider credential refresh is represented by two concurrent synthetic per-run credential copies.",
    "RTK 0.42.3 rejects the upstream README's abbreviated tee configuration because max_files and max_file_size are required at deserialization time; the checked-in configuration supplies both fields.",
    "The task image is intentionally ARM64-specific for the M1 Max deployment target and must be rebuilt from the pinned Dockerfile on another clean ARM64 host for P0-00 closure."
  ]
}
