{
  "schema_version": "1.0.0",
  "test_id": "P0-DIRECT-RUNTIME-GIT-RTK",
  "candidate": "direct_pi",
  "evidence_kind": "runtime",
  "status": "pass",
  "source_versions": {
    "pi": "0.80.9",
    "rtk": "0.42.3",
    "docker": "27.3.1",
    "task_image": "sha256:7669de2c3791c662a1f59094ad31ff018178de20e843d3485c5796d545688074",
    "fixture": "cef5e049ab9841e8389c6c4f5f0fde5d2385c7b4"
  },
  "host": {
    "os": "macOS 15.7.7",
    "architecture": "arm64",
    "container_runtime": "Docker Desktop 27.3.1"
  },
  "sanitized_command": "node phase0/scripts/probe-direct-runtime-git-rtk.mjs /absolute/generated-fixture",
  "exit_code": 0,
  "started_at": "2026-07-17T13:58:22Z",
  "ended_at": "2026-07-17T13:58:27Z",
  "fixture_commit": "cef5e049ab9841e8389c6c4f5f0fde5d2385c7b4",
  "assertions": [
    {
      "name": "the direct daemon creates, records, inspects, and removes the pinned task container",
      "passed": true,
      "observed": {
        "image_id": "sha256:7669de2c3791c662a1f59094ad31ff018178de20e843d3485c5796d545688074",
        "recorded_container_matched_live_container": true,
        "container_removed_after_stop": true,
        "docker_socket_absent": true,
        "extensions_mount_read_only": true
      }
    },
    {
      "name": "the daemon materializes isolated credential state without changing or leaking the canonical source",
      "passed": true,
      "observed": {
        "source_mount_read_only": true,
        "private_pi_copy_writable": true,
        "canonical_checksum_unchanged": true,
        "private_run_copies_removed": true,
        "oauth_profile_concurrency_limit": 1,
        "competing_run_rejected": true,
        "credential_canary_violations": 0
      }
    },
    {
      "name": "the container edits worktree files while the host owns Git status, diff, and provenance checkpoints",
      "passed": true,
      "observed": {
        "shared_git_metadata_denied": true,
        "host_status_saw_edit": true,
        "host_diff_saw_edit": true,
        "checkpoint_revision": "0aa2e511c600b04f450e4983887aec0beb0dc263",
        "checkpoint_idempotent": true,
        "provenance_trailers_present": true
      }
    },
    {
      "name": "managed RTK output is filtered, raw-retained after redaction, receipted, and indexed",
      "passed": true,
      "observed": {
        "raw_artifacts": 1,
        "redaction_replacements": 3,
        "rtk_canary_violations": 0,
        "indexed_artifact_receipts": 5,
        "command_executed_once": true
      }
    },
    {
      "name": "task-container Git and credential actions stay bound to the active run capability",
      "passed": true,
      "observed": {
        "capability_identity_server_derived": true,
        "workspace_selected_from_run": true,
        "credential_profile_recorded": true,
        "container_and_image_identity_recorded": true
      }
    }
  ],
  "artifacts": [
    {
      "path": "phase0/direct/runtime.mjs",
      "sha256": "a4cdd25a07f2e9b4fe2db810478b78f67ce8638bf4e5f483ba9533933800dc61",
      "media_type": "text/javascript",
      "tracked": true
    },
    {
      "path": "phase0/direct/credentials.mjs",
      "sha256": "a9fd169a55377596e3fb0d3370ed012c785fa3ff3d14c85783f11f751e2ba91d",
      "media_type": "text/javascript",
      "tracked": true
    },
    {
      "path": "phase0/direct/git-service.mjs",
      "sha256": "58953c04800622cbf99452c2f7470a3a33418ae9d7ddaf8e7e5adee327978c7f",
      "media_type": "text/javascript",
      "tracked": true
    },
    {
      "path": "phase0/direct/artifacts.mjs",
      "sha256": "98e08451f020ef9d1611bca04611a1225c1367554ed8e52a96b0d891a59076fc",
      "media_type": "text/javascript",
      "tracked": true
    },
    {
      "path": "phase0/direct/control-plane.mjs",
      "sha256": "d2a1ec73ce931caf8f99796c5d82d888b6c6175ecec4606fb259ce8c3bf44f31",
      "media_type": "text/javascript",
      "tracked": true
    },
    {
      "path": "phase0/pi/rtk-managed-extension.ts",
      "sha256": "e750a26d0395bed322f9877290119e5e291eb5dbab6aa4440b7ce9edd4d5cfd6",
      "media_type": "text/typescript",
      "tracked": true
    },
    {
      "path": "phase0/schemas/provider-profile.schema.json",
      "sha256": "80f7a6e93e9cb3448f7d4f35ac0a6da4f46172d73a67bec7c7cea2a5267bccb1",
      "media_type": "application/schema+json",
      "tracked": true
    },
    {
      "path": "phase0/scripts/probe-direct-runtime-git-rtk.mjs",
      "sha256": "ea93de43b81cd59dfe2fe3de929f18f62ded7c4efcc263cfb4a6da0679de5ef5",
      "media_type": "text/javascript",
      "tracked": true
    }
  ],
  "redactions": [
    {
      "class": "synthetic_credential",
      "count": 1
    },
    {
      "class": "synthetic_command_output",
      "count": 3
    }
  ],
  "mappings": {
    "product_requirements": ["PRODUCT 7.2", "PRODUCT 7.3", "PRODUCT 7.4", "PRODUCT 7.7", "PRODUCT 7.8", "PRODUCT 8.1", "PRODUCT 8.2", "PRODUCT 8.3", "PRODUCT 9.6", "PRODUCT 10.4"],
    "technical_risks": ["TECH risk 2", "TECH risk 4", "TECH risk 5", "TECH risk 7", "TECH risk 8", "TECH risk 13"],
    "hard_gates": ["G-01", "G-05", "G-06"]
  },
  "limitations": [
    "The credential is synthetic and the provider is deterministic; an owner-operated real Pi login smoke remains before C0-02 is declared closed.",
    "OAuth refresh mutations in private run state are intentionally discarded. Parallel OAuth runs remain disabled until locked reconciliation or a credential broker is approved.",
    "The container uses bridge networking so Pi can reach the host control plane and a future model provider. This is accidental-damage containment, not a malicious-code boundary or an egress firewall.",
    "The Phase 0 runtime adapter uses the local Docker CLI as its Engine transport; the daemon/container authority boundary does not depend on that transport choice.",
    "Crash reconciliation now passes separately in P0-DIRECT-RESTART-RECONCILIATION; this fixture covers the normal completion path."
  ]
}
